procedure_name,code_type,code,modifier
Routine Gastro Pacemaker insertion,CPTCode,33206,
Advanced Pediatric Defibrillator insertion,CPTCode,33249,
Therapeutic Dermatology Aortic valve replacement,CPTCode,33405,
Specialized Gastro Mitral valve repair,CPTCode,33425,
Follow-up ENT Carotid endarterectomy,CPTCode,35301,
Follow-up Neurological Aortic aneurysm repair,CPTCode,35082,
Emergency Renal Peripheral vascular bypass,CPTCode,35556,
Therapeutic Renal Varicose vein surgery,CPTCode,37700,
Routine Pulmonary Arteriovenous fistula creation,CPTCode,36821,
Comprehensive Oncology Hip replacement total,CPTCode,27130,
Diagnostic Cardiac Knee replacement total,CPTCode,27447,
Specialized Renal Shoulder replacement total,CPTCode,23472,
Screening Pulmonary Spinal fusion lumbar,CPTCode,22612,
Comprehensive ENT Spinal fusion cervical,CPTCode,22551,
Comprehensive Pediatric Laminectomy,CPTCode,63030,
Emergency Pediatric Discectomy,CPTCode,63030,
Screening Dermatology Carpal tunnel release,CPTCode,64721,
Comprehensive Dermatology Trigger finger release,CPTCode,26055,
Advanced ENT Tendon repair,CPTCode,27650,
Specialized Oncology Fracture repair closed,CPTCode,25600,
Specialized Renal Fracture repair open,CPTCode,25607,
Comprehensive Cardiac Amputation lower extremity,CPTCode,27592,
Follow-up Neurological Skin graft split thickness,CPTCode,15100,
Targeted Pediatric Burn debridement,CPTCode,16020,
Specialized Dermatology Flap reconstruction,CPTCode,15734,
Specialized Renal Rhinoplasty secondary,CPTCode,30430,
Diagnostic Pulmonary Blepharoplasty,CPTCode,15822,
Diagnostic Oncology Facelift,CPTCode,15824,
Routine Renal Breast augmentation,CPTCode,19325,
Diagnostic Pediatric Breast reduction,CPTCode,19318,
Specialized Neurological Breast reconstruction,CPTCode,19357,
Targeted Neurological Liposuction,CPTCode,15877,
Diagnostic Gastro Abdominoplasty,CPTCode,15847,
Emergency Renal Craniotomy,CPTCode,61510,
Follow-up Renal Craniectomy,CPTCode,61322,
Emergency Cardiac Ventricular shunt,CPTCode,62220,
Targeted Gastro Deep brain stimulation,CPTCode,61863,
Specialized Pediatric Vagus nerve stimulation,CPTCode,64568,
Therapeutic Pediatric Electroencephalography,CPTCode,95819,
Therapeutic Gastro Nerve conduction study,CPTCode,95907,
Screening Cardiac EMG,CPTCode,95860,
Routine Gastro Sleep study,CPTCode,95810,
Screening Neurological Tilt table test,CPTCode,93660,
Comprehensive ENT Bone density scan,CPTCode,77080,
Emergency Pediatric Nuclear medicine scan,CPTCode,78300,
Follow-up Orthopedic PET scan,CPTCode,78816,
Targeted Cardiac Mammogram screening,CPTCode,77067,
Diagnostic Renal Mammogram diagnostic,CPTCode,77066,
Emergency Gastro Pap smear,CPTCode,88141,
Specialized Oncology Urinalysis,CPTCode,81001,
Advanced Gastro Complete blood count,CPTCode,85025,
Follow-up Dermatology Comprehensive metabolic panel,CPTCode,80053,
Advanced Oncology Lipid panel,CPTCode,80061,
Advanced Dermatology Thyroid panel,CPTCode,84436,
Emergency Neurological Hemoglobin A1c,CPTCode,83036,
Screening Gastro Prothrombin time,CPTCode,85610,
Follow-up Neurological PTT,CPTCode,85730,
Follow-up Renal D-dimer,CPTCode,85379,
Follow-up Pediatric Troponin,CPTCode,84484,
Routine Gastro BNP,CPTCode,83880,
Follow-up Pediatric PSA,CPTCode,86316,
Routine Oncology CEA,CPTCode,82378,
Specialized Renal CA-125,CPTCode,86304,
Screening Orthopedic AFP,CPTCode,82105,
Emergency ENT Beta HCG,CPTCode,84702,
Diagnostic Neurological Vitamin B12,CPTCode,82607,
Diagnostic Renal Folate,CPTCode,82746,
Specialized Cardiac Ferritin,CPTCode,82728,
Diagnostic Pediatric Iron studies,CPTCode,83540,
Targeted ENT Uric acid,CPTCode,84550,
Routine Oncology Cortisol,CPTCode,82533,
Diagnostic Orthopedic Testosterone,CPTCode,84402,
Diagnostic Neurological Estradiol,CPTCode,82670,
Comprehensive Neurological FSH,CPTCode,83001,
Specialized ENT LH,CPTCode,83002,
Follow-up Renal Progesterone,CPTCode,84144,
Targeted Renal Prolactin,CPTCode,84146,
Screening Dermatology DHEA,CPTCode,82626,
Targeted Pulmonary Insulin,CPTCode,83525,
Routine Neurological C-peptide,CPTCode,84681,
Targeted ENT Rheumatoid factor,CPTCode,86431,
Comprehensive Gastro ANA,CPTCode,86038,
Routine Neurological Anti-dsDNA,CPTCode,86060,
Screening Pulmonary Anti-CCP,CPTCode,86200,
Therapeutic Neurological ESR,CPTCode,85651,
Routine Orthopedic CRP,CPTCode,86140,
Diagnostic Dermatology Urine culture,CPTCode,87086,
Emergency Cardiac Blood culture,CPTCode,87040,
Emergency Orthopedic Throat culture,CPTCode,87070,
Screening Neurological Stool culture,CPTCode,87045,
Screening Gastro COVID-19 PCR test,CPTCode,87635,
Follow-up Cardiac Influenza test,CPTCode,87804,
Diagnostic Gastro Strep test rapid,CPTCode,87880,
Follow-up ENT Mono test,CPTCode,86308,
Screening Oncology HIV test,CPTCode,86703,
Diagnostic Neurological Hepatitis B surface antigen,CPTCode,87340,
Routine Gastro Hepatitis C antibody,CPTCode,86803,
Emergency Oncology RPR syphilis test,CPTCode,86592,
Emergency Pulmonary Chlamydia gonorrhea NAAT,CPTCode,87491,
Specialized Pulmonary Physical therapy evaluation,CPTCode,97161,
Follow-up Renal Physical therapy treatment,CPTCode,97110,
Routine Pediatric Occupational therapy evaluation,CPTCode,97165,
Emergency Cardiac Speech therapy evaluation,CPTCode,92521,
Routine Dermatology Psychiatric evaluation,CPTCode,90792,
Routine ENT Psychotherapy 45 minutes,CPTCode,90834,
Comprehensive Renal Psychotherapy 60 minutes,CPTCode,90837,
Advanced ENT Group therapy,CPTCode,90853,
Specialized Cardiac Medication management,CPTCode,90833,
Follow-up Pulmonary Neuropsychological testing,CPTCode,96130,
Therapeutic Pediatric Allergy skin testing,CPTCode,95004,
Targeted Neurological Allergy immunotherapy,CPTCode,95115,
Emergency Pediatric Immunoglobulin infusion,CPTCode,90281,
Emergency Orthopedic Chemotherapy infusion,CPTCode,96413,
Specialized Oncology Radiation therapy,CPTCode,77401,
Routine Pediatric IMRT planning,CPTCode,77301,
Diagnostic Dermatology Brachytherapy,CPTCode,77761,
Targeted Cardiac Dialysis hemodialysis,CPTCode,90935,
Therapeutic Neurological Peritoneal dialysis,CPTCode,90945,
Advanced Dermatology Plasmapheresis,CPTCode,36514,
Routine Oncology Infusion therapy,CPTCode,96360,
Targeted ENT IV antibiotics,CPTCode,96365,
Follow-up Gastro Total parenteral nutrition,CPTCode,99601,
Routine Orthopedic Nasogastric tube placement,CPTCode,43752,
Diagnostic Oncology Endotracheal intubation,CPTCode,31500,
Screening Renal Mechanical ventilation management,CPTCode,94002,
Routine Orthopedic Central line insertion,CPTCode,36556,
Emergency ENT PICC line insertion,CPTCode,36569,
Diagnostic Oncology Arterial line placement,CPTCode,36620,
Follow-up Dermatology Thoracentesis,CPTCode,32555,
Emergency Dermatology Paracentesis,CPTCode,49083,
Diagnostic Dermatology Pericardiocentesis,CPTCode,33010,
Comprehensive Pulmonary Cardioversion,CPTCode,92960,
Routine Oncology Defibrillation,CPTCode,92950,
Follow-up Orthopedic CPR,CPTCode,92950,
Diagnostic Gastro Nebulizer treatment,CPTCode,94640,
Routine Pediatric Oxygen therapy,CPTCode,94760,
Comprehensive Pulmonary CPAP,HCPCSCode,E0601,
Therapeutic Pediatric BiPAP,HCPCSCode,E0470,
Targeted Neurological Hospital bed,HCPCSCode,E0250,
Targeted Oncology Walker,HCPCSCode,E0130,
Advanced Dermatology Cane,HCPCSCode,E0100,
Diagnostic ENT Crutches,HCPCSCode,E0110,
Routine Neurological Commode,HCPCSCode,E0163,
Routine ENT Bath bench,HCPCSCode,E0245,
Screening Oncology Nebulizer machine,HCPCSCode,E0570,
Therapeutic Gastro Insulin pump,HCPCSCode,E0784,
Advanced ENT Blood glucose monitor,HCPCSCode,E2101,
Emergency Neurological Continuous glucose monitor,HCPCSCode,E2101,
Comprehensive Pulmonary Compression stockings,HCPCSCode,A6531,
Diagnostic Renal Wound dressing,HCPCSCode,A6216,
Specialized Renal Ostomy supplies,HCPCSCode,A4361,
Follow-up Renal Urological catheter,HCPCSCode,A4338,
Routine Pediatric Breast pump,HCPCSCode,E0603,
Comprehensive Pulmonary Hearing aid,HCPCSCode,V5244,
Specialized Gastro Orthotics ankle foot,HCPCSCode,L1960,
Comprehensive Orthopedic Prosthetic limb,HCPCSCode,L5100,
Emergency Neurological Spinal orthosis,HCPCSCode,L0648,
Screening Pulmonary Cervical collar,HCPCSCode,L0120,
Comprehensive ENT Knee brace,HCPCSCode,L1820,
Diagnostic Pulmonary Shoulder sling,HCPCSCode,A4565,
Targeted Gastro Wrist splint,HCPCSCode,L3900,
Advanced Gastro Ambulance transport,HCPCSCode,A0428,
Routine Neurological Non-emergency transport,HCPCSCode,A0100,
Therapeutic Gastro Home health aide,HCPCSCode,G0156,
Specialized Pediatric Skilled nursing visit,HCPCSCode,G0299,
Comprehensive Neurological Physical therapy home,HCPCSCode,G0151,
Comprehensive Oncology Occupational therapy home,HCPCSCode,G0152,
Emergency Orthopedic Flu vaccine,CPTCode,90686,
Advanced ENT COVID-19 vaccine,CPTCode,91300,
Routine Pediatric Pneumococcal vaccine,CPTCode,90670,
Targeted ENT Shingles vaccine,CPTCode,90750,
Targeted Pulmonary MMR vaccine,CPTCode,90707,
Routine ENT HPV vaccine,CPTCode,90651,
Diagnostic Pulmonary Hepatitis B vaccine,CPTCode,90739,
Emergency Pulmonary Tetanus toxoid,CPTCode,90714,
Targeted Gastro Meningococcal vaccine,CPTCode,90734,
Screening Gastro Varicella vaccine,CPTCode,90716,
Screening Pulmonary Chest X-Ray,CPTCode,71045,
Specialized Orthopedic MRI Brain,CPTCode,70551,26.0
Specialized Pulmonary Blood Test,CPTCode,80050,
Therapeutic Dermatology ECG,CPTCode,93000,
Screening Pulmonary CT Scan,CPTCode,74177,
Advanced Pediatric Radiologic exam chest 2 views,CPTCode,71046,
Routine Neurological Subsequent hospital care high complexity,CPTCode,99233,
Targeted Oncology Wheelchair,HCPCSCode,E1161,
Emergency Dermatology Office visit established patient low complexity,CPTCode,99213,
Screening Orthopedic Office visit established patient moderate complexity,CPTCode,99214,
Advanced Oncology Office visit new patient moderate complexity,CPTCode,99203,
Comprehensive Orthopedic Annual wellness visit,CPTCode,G0439,
Comprehensive Dermatology Preventive visit adult,CPTCode,99396,
Screening ENT MRI Spine lumbar,CPTCode,72148,26.0
Emergency Renal MRI Knee,CPTCode,73721,26.0
Targeted Pulmonary MRI Shoulder,CPTCode,73221,26.0
Comprehensive Renal CT Head,CPTCode,70450,
Routine Dermatology CT Abdomen pelvis,CPTCode,74178,
Therapeutic Gastro CT Chest,CPTCode,71250,
Follow-up Pulmonary Ultrasound abdomen,CPTCode,76700,
Therapeutic Pediatric Ultrasound pelvis,CPTCode,76856,
Screening Dermatology Ultrasound thyroid,CPTCode,76536,
Advanced Gastro Echocardiogram,CPTCode,93306,26.0
Routine Oncology Stress test,CPTCode,93015,
Therapeutic Cardiac Holter monitor,CPTCode,93224,
Advanced Dermatology Pulmonary function test,CPTCode,94010,
Advanced Oncology Spirometry,CPTCode,94060,
Diagnostic Dermatology Colonoscopy,CPTCode,45378,
Advanced Neurological Upper endoscopy,CPTCode,43239,
Screening Pediatric Sigmoidoscopy,CPTCode,45331,
Therapeutic Oncology Bronchoscopy,CPTCode,31622,
Emergency Neurological Cystoscopy,CPTCode,52000,
Comprehensive Oncology Arthroscopy knee,CPTCode,29881,
Emergency Cardiac Arthroscopy shoulder,CPTCode,29826,
Screening ENT Lumbar puncture,CPTCode,62270,
Diagnostic ENT Bone marrow biopsy,CPTCode,38221,
Advanced Pulmonary Liver biopsy,CPTCode,47000,
Advanced ENT Kidney biopsy,CPTCode,50200,
Comprehensive Cardiac Skin biopsy,CPTCode,11102,
Diagnostic Cardiac Fine needle aspiration,CPTCode,10021,
Emergency Cardiac Excision of lesion skin,CPTCode,11400,
Targeted Oncology Laceration repair simple,CPTCode,12001,
Screening Pulmonary Laceration repair complex,CPTCode,13100,
Follow-up Dermatology Abscess incision drainage,CPTCode,10060,
Comprehensive Pediatric Nail removal,CPTCode,11730,
Targeted ENT Cerumen removal,CPTCode,69210,
Follow-up Orthopedic Cataract surgery,CPTCode,66984,
Routine ENT Vitrectomy,CPTCode,67036,
Routine Pediatric LASIK,CPTCode,66999,
Advanced Pediatric Tonsillectomy,CPTCode,42825,
Screening Cardiac Adenoidectomy,CPTCode,42830,
Advanced Pediatric Septoplasty,CPTCode,30520,
Routine Oncology Rhinoplasty,CPTCode,30400,
Advanced Gastro Sinus surgery,CPTCode,31256,
Targeted Cardiac Thyroidectomy total,CPTCode,60240,
Therapeutic Pulmonary Parathyroidectomy,CPTCode,60500,
Comprehensive Renal Mastectomy simple,CPTCode,19301,
Targeted Pediatric Lumpectomy,CPTCode,19301,
Follow-up Orthopedic Sentinel node biopsy,CPTCode,38792,
Follow-up Neurological Hysterectomy total abdominal,CPTCode,58150,
Diagnostic Gastro Hysterectomy laparoscopic,CPTCode,58570,
Targeted Oncology Myomectomy abdominal,CPTCode,58140,
Comprehensive Oncology Oophorectomy,CPTCode,58940,
Follow-up Pulmonary Tubal ligation,CPTCode,58600,
Screening ENT Cesarean section,CPTCode,59510,
Advanced Dermatology Normal vaginal delivery,CPTCode,59400,
Screening Neurological Dilation and curettage,CPTCode,58120,
Comprehensive Pediatric Colposcopy,CPTCode,57454,
Follow-up Pulmonary LEEP procedure,CPTCode,57461,
Specialized Pulmonary Prostatectomy radical,CPTCode,55810,
Diagnostic Renal Transurethral resection prostate,CPTCode,52601,
Specialized Renal Vasectomy,CPTCode,55250,
Follow-up Gastro Orchiectomy,CPTCode,54520,
Advanced Neurological Nephrectomy,CPTCode,50220,
Follow-up Gastro Cholecystectomy laparoscopic,CPTCode,47562,
Emergency Oncology Appendectomy,CPTCode,44950,
Follow-up Orthopedic Hernia repair inguinal,CPTCode,49505,
Therapeutic Oncology Hernia repair ventral,CPTCode,49560,
Diagnostic Oncology Colectomy partial,CPTCode,44140,
Diagnostic Pediatric Colostomy,CPTCode,44320,
Routine Pulmonary Hemorrhoidectomy,CPTCode,46250,
Therapeutic Renal Fistulectomy,CPTCode,46270,
Diagnostic Oncology Splenectomy,CPTCode,38100,
Therapeutic Pulmonary Gastrectomy partial,CPTCode,43631,
Specialized Pediatric Gastric bypass,CPTCode,43644,
Follow-up Gastro Sleeve gastrectomy,CPTCode,43775,
Advanced Gastro Whipple procedure,CPTCode,48150,
Diagnostic Orthopedic Coronary artery bypass graft,CPTCode,33533,
Emergency ENT Cardiac catheterization,CPTCode,93454,
Diagnostic Dermatology Percutaneous coronary intervention,CPTCode,92920,
Routine Pediatric Pacemaker insertion,CPTCode,33206,
Follow-up Gastro Defibrillator insertion,CPTCode,33249,
Therapeutic Gastro Aortic valve replacement,CPTCode,33405,
Advanced Renal Mitral valve repair,CPTCode,33425,
Specialized Orthopedic Carotid endarterectomy,CPTCode,35301,
Emergency Gastro Aortic aneurysm repair,CPTCode,35082,
Targeted Renal Peripheral vascular bypass,CPTCode,35556,
Diagnostic Pulmonary Varicose vein surgery,CPTCode,37700,
Comprehensive Neurological Arteriovenous fistula creation,CPTCode,36821,
Comprehensive Pulmonary Hip replacement total,CPTCode,27130,
Specialized ENT Knee replacement total,CPTCode,27447,
Therapeutic Neurological Shoulder replacement total,CPTCode,23472,
Advanced Orthopedic Spinal fusion lumbar,CPTCode,22612,
Routine Neurological Spinal fusion cervical,CPTCode,22551,
Follow-up Neurological Laminectomy,CPTCode,63030,
Advanced Neurological Discectomy,CPTCode,63030,
Comprehensive Orthopedic Carpal tunnel release,CPTCode,64721,
Comprehensive Neurological Trigger finger release,CPTCode,26055,
Therapeutic Cardiac Tendon repair,CPTCode,27650,
Diagnostic Neurological Fracture repair closed,CPTCode,25600,
Routine Renal Fracture repair open,CPTCode,25607,
Targeted ENT Amputation lower extremity,CPTCode,27592,
Emergency ENT Skin graft split thickness,CPTCode,15100,
Specialized Cardiac Burn debridement,CPTCode,16020,
Comprehensive Pulmonary Flap reconstruction,CPTCode,15734,
Advanced Pulmonary Rhinoplasty secondary,CPTCode,30430,
Follow-up Pediatric Blepharoplasty,CPTCode,15822,
Targeted Renal Facelift,CPTCode,15824,
Diagnostic Oncology Breast augmentation,CPTCode,19325,
Diagnostic Orthopedic Breast reduction,CPTCode,19318,
Emergency Dermatology Breast reconstruction,CPTCode,19357,
Follow-up Renal Liposuction,CPTCode,15877,
Screening Renal Abdominoplasty,CPTCode,15847,
Specialized Oncology Craniotomy,CPTCode,61510,
Specialized ENT Craniectomy,CPTCode,61322,
Routine Renal Ventricular shunt,CPTCode,62220,
Specialized Cardiac Deep brain stimulation,CPTCode,61863,
Advanced Neurological Vagus nerve stimulation,CPTCode,64568,
Targeted Orthopedic Electroencephalography,CPTCode,95819,
Advanced Renal Nerve conduction study,CPTCode,95907,
Specialized ENT EMG,CPTCode,95860,
Diagnostic Gastro Sleep study,CPTCode,95810,
Therapeutic Gastro Tilt table test,CPTCode,93660,
Therapeutic Orthopedic Bone density scan,CPTCode,77080,
Routine Orthopedic Nuclear medicine scan,CPTCode,78300,
Therapeutic Pediatric PET scan,CPTCode,78816,
Advanced Neurological Mammogram screening,CPTCode,77067,
Emergency Gastro Mammogram diagnostic,CPTCode,77066,
Screening Renal Pap smear,CPTCode,88141,
Targeted Gastro Urinalysis,CPTCode,81001,
Routine Gastro Complete blood count,CPTCode,85025,
Emergency Pulmonary Comprehensive metabolic panel,CPTCode,80053,
Comprehensive Gastro Lipid panel,CPTCode,80061,
Therapeutic Pulmonary Thyroid panel,CPTCode,84436,
Targeted Pediatric Hemoglobin A1c,CPTCode,83036,
Follow-up ENT Prothrombin time,CPTCode,85610,
Targeted Cardiac PTT,CPTCode,85730,
Diagnostic Gastro D-dimer,CPTCode,85379,
Therapeutic Dermatology Troponin,CPTCode,84484,
Follow-up Pulmonary BNP,CPTCode,83880,
Diagnostic Orthopedic PSA,CPTCode,86316,
Routine Renal CEA,CPTCode,82378,
Diagnostic Gastro CA-125,CPTCode,86304,
Specialized Pulmonary AFP,CPTCode,82105,
Emergency ENT Beta HCG,CPTCode,84702,
Advanced Neurological Vitamin B12,CPTCode,82607,
Therapeutic Renal Folate,CPTCode,82746,
Routine Renal Ferritin,CPTCode,82728,
Therapeutic Pediatric Iron studies,CPTCode,83540,
Comprehensive Cardiac Uric acid,CPTCode,84550,
Emergency Renal Cortisol,CPTCode,82533,
Targeted ENT Testosterone,CPTCode,84402,
Advanced Cardiac Estradiol,CPTCode,82670,
Emergency Dermatology FSH,CPTCode,83001,
Emergency Orthopedic LH,CPTCode,83002,
Diagnostic Pulmonary Progesterone,CPTCode,84144,
Comprehensive Cardiac Prolactin,CPTCode,84146,
Screening Gastro DHEA,CPTCode,82626,
Diagnostic Pediatric Insulin,CPTCode,83525,
Diagnostic Oncology C-peptide,CPTCode,84681,
Comprehensive Pulmonary Rheumatoid factor,CPTCode,86431,
Specialized Orthopedic ANA,CPTCode,86038,
Routine Oncology Anti-dsDNA,CPTCode,86060,
Therapeutic Orthopedic Anti-CCP,CPTCode,86200,
Therapeutic Pediatric ESR,CPTCode,85651,
Diagnostic Dermatology CRP,CPTCode,86140,
Advanced Pulmonary Urine culture,CPTCode,87086,
Screening ENT Blood culture,CPTCode,87040,
Diagnostic Gastro Throat culture,CPTCode,87070,
Diagnostic Gastro Stool culture,CPTCode,87045,
Emergency Dermatology COVID-19 PCR test,CPTCode,87635,
Follow-up Gastro Influenza test,CPTCode,87804,
Emergency Dermatology Strep test rapid,CPTCode,87880,
Comprehensive ENT Mono test,CPTCode,86308,
Emergency Oncology HIV test,CPTCode,86703,
Diagnostic Oncology Hepatitis B surface antigen,CPTCode,87340,
Targeted Pulmonary Hepatitis C antibody,CPTCode,86803,
Specialized ENT RPR syphilis test,CPTCode,86592,
Advanced Pediatric Chlamydia gonorrhea NAAT,CPTCode,87491,
Screening Renal Physical therapy evaluation,CPTCode,97161,
Follow-up Orthopedic Physical therapy treatment,CPTCode,97110,
Follow-up Dermatology Occupational therapy evaluation,CPTCode,97165,
Routine Pulmonary Speech therapy evaluation,CPTCode,92521,
Comprehensive Pulmonary Psychiatric evaluation,CPTCode,90792,
Emergency Neurological Psychotherapy 45 minutes,CPTCode,90834,
Follow-up Pediatric Psychotherapy 60 minutes,CPTCode,90837,
Targeted Dermatology Group therapy,CPTCode,90853,
Routine Cardiac Medication management,CPTCode,90833,
Specialized Orthopedic Neuropsychological testing,CPTCode,96130,
Comprehensive Oncology Allergy skin testing,CPTCode,95004,
Diagnostic Oncology Allergy immunotherapy,CPTCode,95115,
Screening Gastro Immunoglobulin infusion,CPTCode,90281,
Therapeutic Cardiac Chemotherapy infusion,CPTCode,96413,
Routine Renal Radiation therapy,CPTCode,77401,
Targeted Dermatology IMRT planning,CPTCode,77301,
Screening Neurological Brachytherapy,CPTCode,77761,
Specialized Pediatric Dialysis hemodialysis,CPTCode,90935,
Routine ENT Peritoneal dialysis,CPTCode,90945,
Specialized ENT Plasmapheresis,CPTCode,36514,
Therapeutic Cardiac Infusion therapy,CPTCode,96360,
Advanced Neurological IV antibiotics,CPTCode,96365,
Routine Gastro Total parenteral nutrition,CPTCode,99601,
Comprehensive Renal Nasogastric tube placement,CPTCode,43752,
Therapeutic Oncology Endotracheal intubation,CPTCode,31500,
Targeted Cardiac Mechanical ventilation management,CPTCode,94002,
Targeted Cardiac Central line insertion,CPTCode,36556,
Diagnostic Orthopedic PICC line insertion,CPTCode,36569,
Emergency Renal Arterial line placement,CPTCode,36620,
Targeted Cardiac Thoracentesis,CPTCode,32555,
Emergency Oncology Paracentesis,CPTCode,49083,
Follow-up Renal Pericardiocentesis,CPTCode,33010,
Emergency Pediatric Cardioversion,CPTCode,92960,
Routine Neurological Defibrillation,CPTCode,92950,
Screening Gastro CPR,CPTCode,92950,
Follow-up Gastro Nebulizer treatment,CPTCode,94640,
Specialized Dermatology Oxygen therapy,CPTCode,94760,
Diagnostic Pulmonary CPAP,HCPCSCode,E0601,
Comprehensive Neurological BiPAP,HCPCSCode,E0470,
Diagnostic Pediatric Hospital bed,HCPCSCode,E0250,
Targeted ENT Walker,HCPCSCode,E0130,
Therapeutic Neurological Cane,HCPCSCode,E0100,
Emergency Neurological Crutches,HCPCSCode,E0110,
Follow-up Cardiac Commode,HCPCSCode,E0163,
Screening Orthopedic Bath bench,HCPCSCode,E0245,
Emergency Orthopedic Nebulizer machine,HCPCSCode,E0570,
Follow-up Pulmonary Insulin pump,HCPCSCode,E0784,
Targeted Renal Blood glucose monitor,HCPCSCode,E2101,
Diagnostic Gastro Continuous glucose monitor,HCPCSCode,E2101,
Emergency Cardiac Compression stockings,HCPCSCode,A6531,
Emergency Neurological Wound dressing,HCPCSCode,A6216,
Follow-up Cardiac Ostomy supplies,HCPCSCode,A4361,
Advanced Pulmonary Urological catheter,HCPCSCode,A4338,
Targeted Orthopedic Breast pump,HCPCSCode,E0603,
Comprehensive Dermatology Hearing aid,HCPCSCode,V5244,
Emergency ENT Orthotics ankle foot,HCPCSCode,L1960,
Specialized Pulmonary Prosthetic limb,HCPCSCode,L5100,
Advanced Cardiac Spinal orthosis,HCPCSCode,L0648,
Specialized Renal Cervical collar,HCPCSCode,L0120,
Therapeutic Cardiac Knee brace,HCPCSCode,L1820,
Targeted ENT Shoulder sling,HCPCSCode,A4565,
Diagnostic ENT Wrist splint,HCPCSCode,L3900,
Therapeutic Pulmonary Ambulance transport,HCPCSCode,A0428,
Emergency Cardiac Non-emergency transport,HCPCSCode,A0100,
Advanced Renal Home health aide,HCPCSCode,G0156,
Diagnostic Gastro Skilled nursing visit,HCPCSCode,G0299,
Comprehensive Oncology Physical therapy home,HCPCSCode,G0151,
Advanced Orthopedic Occupational therapy home,HCPCSCode,G0152,
Routine Gastro Flu vaccine,CPTCode,90686,
Screening Cardiac COVID-19 vaccine,CPTCode,91300,
Routine Neurological Pneumococcal vaccine,CPTCode,90670,
Therapeutic Gastro Shingles vaccine,CPTCode,90750,
Therapeutic Oncology MMR vaccine,CPTCode,90707,
Targeted ENT HPV vaccine,CPTCode,90651,
Specialized Oncology Hepatitis B vaccine,CPTCode,90739,
Specialized Oncology Tetanus toxoid,CPTCode,90714,
Screening Gastro Meningococcal vaccine,CPTCode,90734,
Routine Dermatology Varicella vaccine,CPTCode,90716,
Emergency Cardiac Chest X-Ray,CPTCode,71045,
Diagnostic Gastro MRI Brain,CPTCode,70551,26.0
Routine Pediatric Blood Test,CPTCode,80050,
Therapeutic Neurological ECG,CPTCode,93000,
Screening Neurological CT Scan,CPTCode,74177,
Screening Pediatric Radiologic exam chest 2 views,CPTCode,71046,
Specialized Oncology Subsequent hospital care high complexity,CPTCode,99233,
Advanced Orthopedic Wheelchair,HCPCSCode,E1161,
Follow-up Gastro Office visit established patient low complexity,CPTCode,99213,
Advanced Orthopedic Office visit established patient moderate complexity,CPTCode,99214,
Therapeutic ENT Office visit new patient moderate complexity,CPTCode,99203,
Screening Dermatology Annual wellness visit,CPTCode,G0439,
Emergency Cardiac Preventive visit adult,CPTCode,99396,
Emergency Pulmonary MRI Spine lumbar,CPTCode,72148,26.0
Diagnostic Pulmonary MRI Knee,CPTCode,73721,26.0
Diagnostic ENT MRI Shoulder,CPTCode,73221,26.0
Emergency Oncology CT Head,CPTCode,70450,
Specialized Pediatric CT Abdomen pelvis,CPTCode,74178,
Specialized ENT CT Chest,CPTCode,71250,
Therapeutic Renal Ultrasound abdomen,CPTCode,76700,
Specialized Dermatology Ultrasound pelvis,CPTCode,76856,
Routine Dermatology Ultrasound thyroid,CPTCode,76536,
Follow-up Oncology Echocardiogram,CPTCode,93306,26.0
Screening Renal Stress test,CPTCode,93015,
Screening Cardiac Holter monitor,CPTCode,93224,
Emergency Dermatology Pulmonary function test,CPTCode,94010,
Diagnostic Pulmonary Spirometry,CPTCode,94060,
Therapeutic Gastro Colonoscopy,CPTCode,45378,
Follow-up Oncology Upper endoscopy,CPTCode,43239,
Targeted Pulmonary Sigmoidoscopy,CPTCode,45331,
Targeted ENT Bronchoscopy,CPTCode,31622,
Routine Pulmonary Cystoscopy,CPTCode,52000,
Screening Pulmonary Arthroscopy knee,CPTCode,29881,
Specialized Gastro Arthroscopy shoulder,CPTCode,29826,
Specialized ENT Lumbar puncture,CPTCode,62270,
Comprehensive Dermatology Bone marrow biopsy,CPTCode,38221,
Follow-up Pediatric Liver biopsy,CPTCode,47000,
Advanced Cardiac Kidney biopsy,CPTCode,50200,
Targeted Pediatric Skin biopsy,CPTCode,11102,
Diagnostic Oncology Fine needle aspiration,CPTCode,10021,
Specialized Oncology Excision of lesion skin,CPTCode,11400,
Targeted Orthopedic Laceration repair simple,CPTCode,12001,
Comprehensive Cardiac Laceration repair complex,CPTCode,13100,
Diagnostic Renal Abscess incision drainage,CPTCode,10060,
Routine Dermatology Nail removal,CPTCode,11730,
Routine ENT Cerumen removal,CPTCode,69210,
Routine Dermatology Cataract surgery,CPTCode,66984,
Targeted Neurological Vitrectomy,CPTCode,67036,
Emergency Orthopedic LASIK,CPTCode,66999,
Targeted Cardiac Tonsillectomy,CPTCode,42825,
Emergency Gastro Adenoidectomy,CPTCode,42830,
Comprehensive Pediatric Septoplasty,CPTCode,30520,
Advanced Gastro Rhinoplasty,CPTCode,30400,
Diagnostic Oncology Sinus surgery,CPTCode,31256,
Screening Dermatology Thyroidectomy total,CPTCode,60240,
Diagnostic Renal Parathyroidectomy,CPTCode,60500,
Targeted ENT Mastectomy simple,CPTCode,19301,
Follow-up Oncology Lumpectomy,CPTCode,19301,
